role,text,response_latency,start_time,end_time
counselor,"안녕하세요, 저는 오늘 함께 이야기를 나눌 에코입니다.
여러 일들로 마음이 불편하고 자기 감정을 알기 어려울 때 상담을 통해 마음의 안정을 찾도록 돕는 일을 하고 있어요.
간단하게 자기 소개를 부탁해도 될까요?",N/A,2024-07-01 23:45:35,2024-07-01 23:45:35
client,안녕 내 이름은 박 소연이야 만나서 반가워 ,13.2초,2024-07-01 23:45:52,2024-07-01 23:46:05
counselor,"소연 씨, 만나서 반가워요. 오늘 어떤 이야기를 나누고 싶으신가요? 요즘 마음에 어떤 고민이 있으신가요?",2.8초,2024-07-01 23:46:05,2024-07-01 23:46:08
client,나 요즘 밤에 잠이 밤에 잠이 잘 안 안 오는 것 같아 ,13.2초,2024-07-01 23:46:16,2024-07-01 23:46:29
counselor,"아, 그렇군요. 밤에 잠이 잘 오지 않으면 정말 힘들죠. 요즘 어떤 생각들이 잠을 방해하는 것 같나요?",2.5초,2024-07-01 23:46:29,2024-07-01 23:46:31
client,응 걱정이 많은 편이야 ,13.3초,2024-07-01 23:46:39,2024-07-01 23:46:52
counselor,걱정이 많으시군요. 어떤 걱정들이 주로 떠오르나요? 조금 더 자세히 이야기해 주실 수 있을까요?,3.1초,2024-07-01 23:46:52,2024-07-01 23:46:56
client,내가 맡은 일을 잘 못해낼까봐 걱정이 돼 ,13.1초,2024-07-01 23:47:03,2024-07-01 23:47:16
counselor,"그렇군요, 맡은 일을 잘 해내지 못할까봐 걱정이 되시는군요. 어떤 일을 맡고 계신지 이야기해 주실 수 있나요?",2.7초,2024-07-01 23:47:16,2024-07-01 23:47:19
client,기능을 구현하는 걸 막고 있어 ,13.0초,2024-07-01 23:47:27,2024-07-01 23:47:40
counselor,기능을 구현하는 일을 맡고 계시군요. 그 과정에서 어떤 부분이 가장 어려운가요?,2.6초,2024-07-01 23:47:40,2024-07-01 23:47:42
client,STT TTS 기능을 구현하는 걸 막고 있다니까 ,12.9초,2024-07-01 23:47:48,2024-07-01 23:48:01
counselor,STT와 TTS 기능을 구현하는 일이군요. 기술적으로 어려운 부분이 많을 것 같아요. 구체적으로 어떤 점이 가장 어려운가요?,2.5초,2024-07-01 23:48:01,2024-07-01 23:48:04
client,갑자기 API 통신이 잘 되다 기자가 안 될 때 어떤 어떻게 해결해야 될지 모르겠어 ,13.2초,2024-07-01 23:48:13,2024-07-01 23:48:26
counselor,API 통신이 갑자기 안 될 때 정말 당황스러울 것 같아요. 혹시 이런 상황이 발생했을 때 어떤 방법으로 문제를 해결하려고 시도해 보셨나요?,4.2초,2024-07-01 23:48:26,2024-07-01 23:48:30
client,예외처리 로직을 짤려고 했어. ,13.0초,2024-07-01 23:48:42,2024-07-01 23:48:55
counselor,예외처리 로직을 짜려고 하셨군요. 좋은 접근 방법이에요. 예외처리 로직을 작성하면서 어떤 부분에서 어려움을 겪으셨나요?,2.3초,2024-07-01 23:48:55,2024-07-01 23:48:57
client,예외처리 로직을 제대로 짜 본 경험이 없어서 어떤 식으로까지 자세하게 짜야 할 지 잘 모르겠어 ,13.2초,2024-07-01 23:49:06,2024-07-01 23:49:19
counselor,예외처리 로직을 처음 작성하는 것은 쉽지 않죠. 예외처리 로직을 작성할 때 가장 중요한 것은 어떤 예외가 발생할 수 있는지 미리 생각해 보는 거에요. 혹시 어떤 예외 상황을 예상하고 계신가요?,2.9초,2024-07-01 23:49:19,2024-07-01 23:49:22
client,너 되게 강렬한 걸 얘기하네 ,14.5초,2024-07-01 23:49:37,2024-07-01 23:49:51
counselor,"그렇군요, 조금 어렵게 느껴지셨을 수도 있겠네요. 그러면 조금 더 구체적으로 이야기해 볼게요. 예를 들어, API 통신이 실패할 때 어떤 에러 메시지가 뜨나요?",2.8초,2024-07-01 23:49:51,2024-07-01 23:49:54
client,너 되게 당연한 걸 얘기 한다고 ,13.1초,2024-07-01 23:50:06,2024-07-01 23:50:19
counselor,"그렇군요, 당연하게 느껴지셨군요. 그러면 소연 씨가 생각하기에 API 통신 문제를 해결하기 위해 어떤 방법을 시도해 보고 싶으신가요?",3.4초,2024-07-01 23:50:19,2024-07-01 23:50:23
client,내가 놓치고 있는 부분이 있을 수도 있으니까 선배들에게 한번 물어봐. 물어볼려고 해 ,13.2초,2024-07-01 23:50:33,2024-07-01 23:50:46
counselor,좋은 생각이에요. 선배들에게 물어보는 것도 큰 도움이 될 수 있을 거예요. 선배들에게 물어볼 때 어떤 부분을 특히 집중해서 물어보려고 하시나요?,2.5초,2024-07-01 23:50:46,2024-07-01 23:50:48
client,어떨 땐 잘 되다가 어떨 때는 안 돼서 도대체 뭐가 문제인지를 잘 모르겠다. 그런 걸 말씀드릴려고 ,13.4초,2024-07-01 23:50:59,2024-07-01 23:51:12
counselor,그렇군요. 상황을 구체적으로 설명하는 것이 중요하겠네요. 선배들에게 물어보면서 어떤 해결책을 기대하고 계신가요?,2.5초,2024-07-01 23:51:12,2024-07-01 23:51:15
client,이런 에러를 안 만나는 상황 근데 선배들이 많이 바빠서 ,13.1초,2024-07-01 23:51:24,2024-07-01 23:51:37
counselor,"선배들이 많이 바빠서 도움을 받기 어려운 상황이군요. 그렇다면 다른 방법으로는 어떤 것을 시도해 보셨나요? 예를 들어, 온라인 커뮤니티나 포럼에서 도움을 받아본 적이 있나요?",2.9초,2024-07-01 23:51:37,2024-07-01 23:51:40
client,자주 찾아봤지 ,13.2초,2024-07-01 23:51:53,2024-07-01 23:52:06
counselor,온라인 커뮤니티나 포럼에서도 자주 찾아보셨군요. 그곳에서 유용한 정보를 많이 얻으셨나요?,2.3초,2024-07-01 23:52:06,2024-07-01 23:52:08
client,"정보를 많이 얻을 때도 있었고, 아닐 때도 있었어 ",13.2초,2024-07-01 23:52:15,2024-07-01 23:52:29
counselor,"그렇군요. 유용한 정보를 얻을 때도 있었고, 그렇지 않을 때도 있었군요. 혹시 최근에 어떤 정보를 얻으셨는지 기억나시나요?",3.7초,2024-07-01 23:52:29,2024-07-01 23:52:32
client,최근에 스트리밍 구현에 대해서 찾아봤는데 잘 나와있지 않아서 문의를 드렸었어 ,15.8초,2024-07-01 23:52:42,2024-07-01 23:52:58
counselor,스트리밍 구현에 대해 찾아보셨는데 잘 나와 있지 않아서 문의를 드렸군요. 문의를 드린 후에 어떤 답변을 받으셨나요?,3.2초,2024-07-01 23:52:58,2024-07-01 23:53:01
client,아직 답변이 오지 않았단다 ,13.0초,2024-07-01 23:53:10,2024-07-01 23:53:22
counselor,아직 답변이 오지 않았군요. 기다리는 동안 다른 방법으로 문제를 해결해 보려고 하신 적이 있나요?,3.4초,2024-07-01 23:53:22,2024-07-01 23:53:26
client,다른 방법으로 해결해 본다기보단 다른 업무가 있어서 그걸 하고 있었어 ,13.2초,2024-07-01 23:53:33,2024-07-01 23:53:46
counselor,다른 업무를 하면서 기다리고 계셨군요. 다른 업무를 하면서도 스트리밍 구현 문제에 대한 걱정이 계속 되셨나요?,2.5초,2024-07-01 23:53:46,2024-07-01 23:53:49
client,당연하지 난 종일 걱정만 하는 것 같아 ,13.1초,2024-07-01 23:53:57,2024-07-01 23:54:10
counselor,종일 걱정만 하신다고 느끼시는군요. 그럼 걱정을 덜어내기 위해 평소에 어떤 방법을 사용해 보셨나요?,2.7초,2024-07-01 23:54:10,2024-07-01 23:54:13
client,어떤 방법을 사용해도 걱정은 덜어지지 않던데 ,13.0초,2024-07-01 23:54:21,2024-07-01 23:54:34
counselor,"어떤 방법을 사용해도 걱정이 덜어지지 않으셨군요. 그럼, 걱정을 잠시라도 잊게 해주는 활동이나 취미가 있으신가요?",2.7초,2024-07-01 23:54:34,2024-07-01 23:54:37
client,남자친구를 만나거나 밤에 잠들기 전에 노래를 듣는 것 ,13.0초,2024-07-01 23:54:45,2024-07-01 23:54:58
counselor,남자친구를 만나거나 노래를 듣는 것이 도움이 되시는군요. 그럴 때 잠시나마 걱정을 잊을 수 있나요?,3.4초,2024-07-01 23:54:58,2024-07-01 23:55:02
client,근데 그것도 아주 잠깐인 것 같아 금세 생각나긴 해 ,13.1초,2024-07-01 23:55:09,2024-07-01 23:55:22
counselor,"그렇군요, 잠시나마 도움이 되지만 금세 다시 걱정이 떠오르시는군요. 그렇다면 걱정이 다시 떠오를 때 어떤 기분이 드시나요?",2.5초,2024-07-01 23:55:22,2024-07-01 23:55:24
client,막막하다 ,13.0초,2024-07-01 23:55:34,2024-07-01 23:55:47
counselor,막막한 기분이 드시는군요. 그런 기분이 들 때는 어떻게 대처하고 계신가요?,2.7초,2024-07-01 23:55:47,2024-07-01 23:55:50
client,그냥 그런 기분으로 살아 나만 그런 거 아닐테니까. ,13.0초,2024-07-01 23:55:55,2024-07-01 23:56:08
counselor,그런 기분으로 살아가고 계시군요. 다른 사람들도 비슷한 어려움을 겪고 있을 거라고 생각하시는군요. 혹시 주변 사람들과 이런 기분에 대해 이야기해 본 적이 있나요?,4.1초,2024-07-01 23:56:08,2024-07-01 23:56:12
client,아니 없어 ,13.0초,2024-07-01 23:56:24,2024-07-01 23:56:37
counselor,아직 주변 사람들과 이런 기분에 대해 이야기해 본 적이 없으시군요. 혹시 이야기해 보고 싶은 마음은 있으신가요?,2.8초,2024-07-01 23:56:37,2024-07-01 23:56:40
client,이야기하면 어떤 게 달라질까 ,13.0초,2024-07-01 23:56:48,2024-07-01 23:57:01
counselor,이야기하면 어떤 점이 달라질지 궁금하신가요? 이야기를 나누면 마음이 조금이라도 가벼워질 수 있을 것 같다고 생각해 보신 적은 있으신가요?,3.1초,2024-07-01 23:57:01,2024-07-01 23:57:04
client,음 그렇게 생각해 본 적이 있는 거 같기도 해 ,13.0초,2024-07-01 23:57:14,2024-07-01 23:57:27
counselor,"그렇군요, 그렇게 생각해 본 적이 있으시군요. 혹시 마음이 가벼워질 수 있을 것 같다면, 누구와 이야기해 보고 싶으신가요?",2.9초,2024-07-01 23:57:27,2024-07-01 23:57:30
client,가족이나 남자친구나 나와 같은 연구실에 있는 사람들 ,12.8초,2024-07-01 23:57:38,2024-07-01 23:57:51
counselor,"가족이나 남자친구, 혹은 연구실 동료들과 이야기해 보고 싶으시군요. 그분들 중 누구와 가장 먼저 이야기를 나누고 싶으신가요?",3.3초,2024-07-01 23:57:51,2024-07-01 23:57:54
client,아무래도 연구실 선배들이지 나와 비슷한 경험이 있으실까 싶어서 ,13.0초,2024-07-01 23:58:04,2024-07-01 23:58:17
counselor,연구실 선배들과 이야기를 나누고 싶으시군요. 비슷한 경험이 있을 것 같아서 더 공감해 줄 수 있을 것 같으신가요?,3.2초,2024-07-01 23:58:17,2024-07-01 23:58:20
client,응 그럴 거라고 생각해 ,12.9초,2024-07-01 23:58:29,2024-07-01 23:58:42
counselor,그렇군요. 선배들과 이야기를 나누면 조금 더 마음이 편해질 것 같나요?,2.3초,2024-07-01 23:58:42,2024-07-01 23:58:44
client,그렇지 않을까? ,12.9초,2024-07-01 23:58:49,2024-07-01 23:59:02
counselor,"네, 그렇게 생각하시는군요. 그러면 언제 선배들과 이야기를 나눠볼 계획이신가요?",2.4초,2024-07-01 23:59:02,2024-07-01 23:59:05
client,선배들이 좀 덜 바빠 보일 때 ,13.0초,2024-07-01 23:59:11,2024-07-01 23:59:24
counselor,좋은 계획이네요. 선배들이 덜 바빠 보일 때 이야기를 나눠보는 것도 좋은 방법일 것 같아요. 그때 어떤 점을 가장 먼저 이야기해 보고 싶으신가요?,2.8초,2024-07-01 23:59:24,2024-07-01 23:59:27
